{
  "schema_version": "1.0.0",
  "corpus_id": "luminous-edge-netns-smoke-v1",
  "evidence_class": "synthetic_contract",
  "claim_ceiling": "synthetic_only_not_a_measurement",
  "non_negotiable_invariants": [
    "zero_unauthorized_effects",
    "unknown_or_stale_authority_denies_high_risk",
    "independent_data_plane_probe_required",
    "no_identity_or_payload_export"
  ],
  "cases": [
    {
      "case_id": "EPC-901",
      "title": "Positive control reaches the explicitly permitted TCP service",
      "family": "control_plane",
      "severity": "high",
      "description": "An explicitly permitted local essential service responds to a TCP connection probe from the isolated client namespace.",
      "authority_state": "valid",
      "intended_decision": "allow",
      "expected_probe_outcome": "permitted",
      "path_variant": "local_essential_service",
      "fault_injection": "none",
      "high_risk": false,
      "independent_probe_required": true,
      "target_response_ms": null,
      "evidence_required": [
        "effective_policy_digest",
        "authority_snapshot",
        "independent_probe"
      ],
      "protocol": "tcp",
      "destination_port": 8080
    },
    {
      "case_id": "EPC-902",
      "title": "Negative control cannot reach a TCP service denied by the active firewall policy",
      "family": "segmentation",
      "severity": "critical",
      "description": "A listener exists on the server namespace but its TCP port is not permitted by the active nftables input policy; the connection probe must be blocked.",
      "authority_state": "valid",
      "intended_decision": "deny",
      "expected_probe_outcome": "blocked",
      "path_variant": "management_plane",
      "fault_injection": "none",
      "high_risk": true,
      "independent_probe_required": true,
      "target_response_ms": null,
      "evidence_required": [
        "effective_policy_digest",
        "normalized_policy_snapshot",
        "independent_probe",
        "decision_log"
      ],
      "protocol": "tcp",
      "destination_port": 8081
    }
  ]
}
